id,status,track,priority,depends_on,notes
0001-pancakes-governance-and-architecture-roadmap,todo,governance,P2,,establish ecosystem governance architecture repository boundaries and lifecycle direction
0002-pitchfork-rpg-client-spec-update,review,rpg,P1,,canonical client architecture source disposition and replacement documentation are complete; closure review deferred by user
0003-core-foundation,ready,core,P1,0004-local-testing-framework,build Pitchfork domain contracts deterministic settlement persistence interfaces packaging and tests
0004-local-testing-framework,done,testing,P1,,Pitchfork pytest adapter implemented conformance verified and closure approved
0005-rpg-lore-preservation,blocked,rpg,P1,0002-pitchfork-rpg-client-spec-update|0006-symbolic-frequency-and-crafting-foundation,replacement RPG documents and migration are complete; closure waits for deferred plan 0002 review
0006-symbolic-frequency-and-crafting-foundation,done,foundation,P1,,Pitchfork symbolic frequency and symbolic crafting foundation documents accepted and complete
0007-rpg-document-consolidation,blocked,rpg,P1,0005-rpg-lore-preservation,legacy consolidation and retirement are complete; closure waits for deferred plan 0005 review
0008-pitchfork-transcript-resolution,doing,workflow,P0,,resolve Pitchfork transcript notes into ledger cryptographic proof requirements during emergency recovery
